{
  "schema_version": 1,
  "event_id": "01J00000000000000000000003",
  "type": "custom_event",
  "site_id": "site_example",
  "occurred_at": 1760000000000,
  "event_name": "purchase_completed",
  "visitor_id": "11111111-1111-4111-8111-111111111111",
  "properties": {
    "plan": "pro",
    "details": { "currency": "CAD", "amount": 24.5, "test": true, "metadata": null },
    "items": ["one", 2]
  }
}
